{"format":"liveframe-package/1","manifest":{"format":"liveframe-manifest/1","id":"conformance","version":"1","catalogId":"conformance@1","params":{"type":"object","properties":{},"required":[],"additionalProperties":false},"state":{"type":"object","properties":{"count":{"type":"integer"}},"required":["count"],"additionalProperties":false},"initialState":{"count":0},"context":{"type":"object","properties":{},"required":[],"additionalProperties":false},"sources":{},"actions":[]},"scenarios":[{"name":"default","params":{},"context":{},"data":{}}],"code":"const __lf_m0 = (() => {\n\nthrow new Error(\"Store fixtures must never execute\"); const __lf_default = () => null;\nconst __lf_exports = { __proto__: null };\n__lf_exports[\"default\"] = __lf_default;\nreturn __lf_exports;\n})();\nexport default __lf_m0[\"default\"];","hash":"sha256-93f93929b47b9f49ae44f9c51b211144a0aaae47100527c7373f9a71de2606fb"}